{"canonicalization_profile":"atlas-jcs.v1","created_at":"2026-07-25T12:20:01.000000Z","evidence":{"availability":{"context":{"reason_codes":["market_stale"],"status":"unavailable"},"interpretations":{"reason_codes":["market_stale"],"status":"unavailable"},"market":{"reason_codes":[],"status":"available"},"market_history":{"reason_codes":[],"status":"available"},"rules":{"reason_codes":[],"status":"available"},"setups":{"reason_codes":[],"status":"available"},"strategy":{"reason_codes":["context_unavailable"],"status":"unavailable"}},"context":{"availability":{"reason_codes":["market_stale"],"status":"unavailable"},"data":null},"decision":{"availability":"not_implemented","state":null},"evaluated_at":"2026-07-25T12:20:00.000000Z","identity":{"product":"MNQ","strategy_id":"displacement_volume_context","strategy_version":"displacement-volume-context.v1","symbol":"MNQ","timeframe":"5m"},"input_snapshot_at":"2026-07-25T12:05:00.000000Z","interpretations":{"availability":{"reason_codes":["market_stale"],"status":"unavailable"},"interpretations":[]},"market":{"availability":{"reason_codes":[],"status":"available"},"bar_count":288,"economic_instrument":{"symbol":"MNQ"},"history_availability":{"reason_codes":[],"status":"available"},"latest_bar":{"atr":"16","close":{"tick_size":"0.25","value":"20720"},"high":{"tick_size":"0.25","value":"20725"},"is_rth":true,"low":{"tick_size":"0.25","value":"20710"},"occurred_at":"2026-07-25T12:05:00.000000Z","open":{"tick_size":"0.25","value":"20718"},"received_at":"2026-07-25T12:05:02.000000Z","schema_version":"market_state.v1","session_name":"new_york","symbol":"MNQ1!","timeframe":"5m","volume":"1100","volume_ratio":"0.9"},"latest_closed_at":"2026-07-25T12:05:00.000000Z","listed_instrument":{"contract_symbol":"MNQU6","expiry":"2026-09","venue":"CME"},"market_data_series":{"provider":"tradingview","resolution_version":"tradingview-mnq1.v1","resolved_at":"2026-07-25T12:20:00.000000Z","series_type":"continuous","symbol":"MNQ1!"},"observed_at":"2026-07-25T12:20:00.000000Z","source_schema_versions":["market_state.v1"]},"risk":{"account_freshness":"current","approved_quantity":1,"approved_total_candidate_risk":"40","assessed_at":"2026-07-25T12:20:00.000000Z","assessment_id":"risk-a1","candidate_at":"2026-07-25T12:05:00.000000Z","candidate_freshness":"stale","contributing_reasons":["candidate_stale"],"exposure_after":1,"exposure_before":0,"has_delayed_data":true,"maximum_approved_quantity":1,"policy_id":"mnq-internal","policy_version":"risk-policy.v1","position_freshness":"current","primary_reason":"candidate_stale","reconciliation_status":"aligned","remaining_daily_risk_capacity":"460","remaining_drawdown_capacity":"960","requested_quantity":1,"risk_dollars_per_contract":"40","risk_ticks":8,"schema_version":"risk_projection.v1","sizing_mode":"fixed","status":"rejected"},"rules":{"availability":{"reason_codes":[],"status":"available"},"facts":[],"occurred_at":"2026-07-25T12:05:00.000000Z","schema_version":"rule_engine.v1","symbol":"MNQ1!","timeframe":"5m"},"setups":{"availability":{"reason_codes":[],"status":"available"},"occurred_at":"2026-07-25T12:05:00.000000Z","schema_version":"setup_engine.v1","setups":[],"symbol":"MNQ1!","timeframe":"5m"},"source_trust":{"availability":"available","freshness":{"evaluated_at":"2026-07-25T12:20:00.000000Z","expected_close_at":"2026-07-25T12:15:00.000000Z","lateness_seconds":"600","latest_closed_at":"2026-07-25T12:05:00.000000Z","policy_version":"freshness.v1","reason_codes":["latest_bar_stale"],"status":"stale"},"overall":"untrusted","reason_codes":["latest_bar_stale"],"structural_validity":"valid"},"strategy":{"availability":{"reason_codes":["context_unavailable"],"status":"unavailable"},"decisions":[{"confidence":null,"context_fingerprint":"","direction":"neutral","disposition":"no_signal","invalidation":null,"occurred_at":"2026-07-25T12:05:00.000000Z","reason_codes":["context_unavailable"],"setup_ids":[],"stop":null,"strategy_id":"displacement_volume_context","strategy_version":"displacement-volume-context.v1","target":null}]},"trust":{"policy_version":"freshness.v1","reason_codes":["latest_bar_stale"],"status":"untrusted"}},"evidence_profile":"trader_now_complete.v1","idempotency_key":"tns1:4000000000000000000000000000000000000000000000000000000000000004","integrity":{"algorithm":"sha256","evidence_digest":null},"snapshot_id":"019849e3-db00-7000-8000-000000000004","snapshot_schema_version":"trader_now_snapshot.v1","source":{"trader_now_domain_schema_version":"trader_now.v2","trader_now_response_schema_version":"trader_now_response.v2"},"supersedes_snapshot_id":"019849d1-8c00-7000-8000-000000000001"}
