{"canonicalization_profile":"atlas-jcs.v1","created_at":"2026-07-25T12:00:01.000000Z","evidence":{"availability":{"context":{"reason_codes":[],"status":"available"},"interpretations":{"reason_codes":[],"status":"available"},"market":{"reason_codes":[],"status":"available"},"market_history":{"reason_codes":[],"status":"available"},"rules":{"reason_codes":[],"status":"available"},"setups":{"reason_codes":[],"status":"available"},"strategy":{"reason_codes":[],"status":"available"}},"context":{"availability":{"reason_codes":[],"status":"available"},"data":{"calendar_version":"cme-equity-index.2026.v1","classifier_version":"market-context.v1","context_fingerprint":"ctx-a1","occurred_at":"2026-07-25T11:55:00.000000Z","quality":"trusted","session":{"drift_status":"aligned","minutes_since_session_open":145,"minutes_until_session_close":245,"phase":"rth","session_close_at":"2026-07-25T20:00:00.000000Z","session_open_at":"2026-07-25T13:30:00.000000Z","upstream_is_rth":true,"upstream_session_name":"new_york"},"symbol":"MNQ1!","timeframe":"5m","volatility":{"atr_percentile_rank":"0.72","lookback_bars_used":288,"regime":"expanded"}}},"decision":{"availability":"not_implemented","state":null},"evaluated_at":"2026-07-25T12:00:00.000000Z","identity":{"product":"MNQ","strategy_id":"displacement_volume_context","strategy_version":"displacement-volume-context.v1","symbol":"MNQ","timeframe":"5m"},"input_snapshot_at":"2026-07-25T11:55:00.000000Z","interpretations":{"availability":{"reason_codes":[],"status":"available"},"interpretations":[{"detected":true,"direction":"long","interpretation_fingerprint":"int-a1","interpretation_version":"setup-interpretation.v1","occurred_at":"2026-07-25T11:55:00.000000Z","reason_codes":["supporting_facts_aligned"],"setup_id":"displacement","source":"rule_fact","source_fact_ids":["price_above_vwap"]}]},"market":{"availability":{"reason_codes":[],"status":"available"},"bar_count":288,"economic_instrument":{"symbol":"MNQ"},"history_availability":{"reason_codes":[],"status":"available"},"latest_bar":{"atr":"18.5","close":{"tick_size":"0.25","value":"20750.25"},"high":{"tick_size":"0.25","value":"20754.5"},"is_rth":true,"low":{"tick_size":"0.25","value":"20742.75"},"occurred_at":"2026-07-25T11:55:00.000000Z","open":{"tick_size":"0.25","value":"20745"},"received_at":"2026-07-25T11:55:01.000000Z","schema_version":"market_state.v1","session_name":"new_york","symbol":"MNQ1!","timeframe":"5m","volume":"1420","volume_ratio":"1.65"},"latest_closed_at":"2026-07-25T11:55:00.000000Z","listed_instrument":null,"market_data_series":{"provider":"tradingview","resolution_version":"tradingview-mnq1.v1","resolved_at":"2026-07-25T12:00:00.000000Z","series_type":"continuous","symbol":"MNQ1!"},"observed_at":"2026-07-25T12:00:00.000000Z","source_schema_versions":["market_state.v1"]},"risk":null,"rules":{"availability":{"reason_codes":[],"status":"available"},"facts":[{"definition_version":"rule.price-above-vwap.v1","fact_id":"price_above_vwap","reason":null,"status":"computed","value":true}],"occurred_at":"2026-07-25T11:55:00.000000Z","schema_version":"rule_engine.v1","symbol":"MNQ1!","timeframe":"5m"},"setups":{"availability":{"reason_codes":[],"status":"available"},"occurred_at":"2026-07-25T11:55:00.000000Z","schema_version":"setup_engine.v1","setups":[{"definition_version":"setup.displacement.v1","detected":true,"reason":null,"setup_id":"displacement","severity":"high","status":"computed","supporting_fact_ids":["price_above_vwap"]}],"symbol":"MNQ1!","timeframe":"5m"},"source_trust":{"availability":"available","freshness":{"evaluated_at":"2026-07-25T12:00:00.000000Z","expected_close_at":"2026-07-25T11:55:00.000000Z","lateness_seconds":"0","latest_closed_at":"2026-07-25T11:55:00.000000Z","policy_version":"freshness.v1","reason_codes":[],"status":"current"},"overall":"trusted","reason_codes":[],"structural_validity":"valid"},"strategy":{"availability":{"reason_codes":[],"status":"available"},"decisions":[{"confidence":"0.81","context_fingerprint":"ctx-a1","direction":"long","disposition":"candidate","invalidation":{"tick_size":"0.25","value":"20740"},"occurred_at":"2026-07-25T11:55:00.000000Z","reason_codes":["setup_and_context_aligned"],"setup_ids":["displacement"],"stop":{"tick_size":"0.25","value":"20740"},"strategy_id":"displacement_volume_context","strategy_version":"displacement-volume-context.v1","target":{"tick_size":"0.25","value":"20770"}}]},"trust":{"policy_version":"freshness.v1","reason_codes":[],"status":"trusted"}},"evidence_profile":"trader_now_complete.v1","idempotency_key":"tns1:1000000000000000000000000000000000000000000000000000000000000001","integrity":{"algorithm":"sha256","evidence_digest":null},"snapshot_id":"019849d1-8c00-7000-8000-000000000001","snapshot_schema_version":"trader_now_snapshot.v1","source":{"trader_now_domain_schema_version":"trader_now.v2","trader_now_response_schema_version":"trader_now_response.v2"},"supersedes_snapshot_id":null}
