{"canonicalization_profile":"atlas-jcs.v1","created_at":"2026-07-25T12:05:01.000000Z","evidence":{"availability":{"context":{"reason_codes":["market_unavailable"],"status":"unavailable"},"interpretations":{"reason_codes":["rules_unavailable"],"status":"unavailable"},"market":{"reason_codes":["no_market_data"],"status":"unavailable"},"market_history":{"reason_codes":["no_market_data"],"status":"unavailable"},"rules":{"reason_codes":["market_unavailable"],"status":"unavailable"},"setups":{"reason_codes":["rules_unavailable"],"status":"unavailable"},"strategy":{"reason_codes":["dependencies_unavailable"],"status":"unavailable"}},"context":{"availability":{"reason_codes":["market_unavailable"],"status":"unavailable"},"data":null},"decision":{"availability":"not_implemented","state":null},"evaluated_at":"2026-07-25T12:05:00.000000Z","identity":{"product":"MNQ","strategy_id":"displacement_volume_context","strategy_version":"displacement-volume-context.v1","symbol":"MNQ","timeframe":"5m"},"input_snapshot_at":null,"interpretations":{"availability":{"reason_codes":["rules_unavailable"],"status":"unavailable"},"interpretations":[]},"market":{"availability":{"reason_codes":["no_market_data"],"status":"unavailable"},"bar_count":0,"economic_instrument":null,"history_availability":{"reason_codes":["no_market_data"],"status":"unavailable"},"latest_bar":null,"latest_closed_at":null,"listed_instrument":null,"market_data_series":null,"observed_at":null,"source_schema_versions":[]},"risk":null,"rules":{"availability":{"reason_codes":["market_unavailable"],"status":"unavailable"},"facts":[],"occurred_at":null,"schema_version":null,"symbol":null,"timeframe":null},"setups":{"availability":{"reason_codes":["rules_unavailable"],"status":"unavailable"},"occurred_at":null,"schema_version":null,"setups":[],"symbol":null,"timeframe":null},"source_trust":{"availability":"unavailable","freshness":{"evaluated_at":"2026-07-25T12:05:00.000000Z","expected_close_at":"2026-07-25T12:00:00.000000Z","lateness_seconds":null,"latest_closed_at":null,"policy_version":"freshness.v1","reason_codes":["no_data"],"status":"unavailable"},"overall":"untrusted","reason_codes":["no_data"],"structural_validity":"not_applicable"},"strategy":{"availability":{"reason_codes":["dependencies_unavailable"],"status":"unavailable"},"decisions":[]},"trust":{"policy_version":"freshness.v1","reason_codes":["no_data"],"status":"untrusted"}},"evidence_profile":"trader_now_complete.v1","idempotency_key":"tns1:2000000000000000000000000000000000000000000000000000000000000002","integrity":{"algorithm":"sha256","evidence_digest":null},"snapshot_id":"019849d6-1fd0-7000-8000-000000000002","snapshot_schema_version":"trader_now_snapshot.v1","source":{"trader_now_domain_schema_version":"trader_now.v2","trader_now_response_schema_version":"trader_now_response.v2"},"supersedes_snapshot_id":null}
